{
  "session_id": "session-2026-08-17-001",
  "started_at": "2026-08-17T08:00:00Z",
  "ended_at": "2026-08-17T08:15:00Z",
  "repository_path": "/Users/super_user/Projects/Skill-HQE",
  "completed": [
    "Phase -1: PR Harvest",
    "Phase 0: Orientation & Manifest Ingestion",
    "Phase 1: Security Deep Scan"
  ],
  "in_progress": [
    "Phase 3: Remediation for HQE-SEC-001"
  ],
  "discovered": [
    "HQE-SEC-001",
    "HQE-BUG-002",
    "HQE-DEBT-003"
  ],
  "reprioritized": [],
  "next_session": [
    "Implement fail-fast error propagation in auth handler",
    "Execute Tier 1 verification with cargo test"
  ]
}
